sample,function,source,Time,Time .1,Token number,tape number,clause I,clause f,clause m,Label,cluster
Oh look I'm getting pushed out the queue beca I'm gonna  There we are,DIR,BNCKB8,,,10369.0,6900.0,1.0,0.0,0.0,,-1
"Oh Look Natalie.Behave, come on.Natalie look, look.",DIR,BNCFXM,,,27.0,93815.0,1.0,0.0,0.0,,-1
"Oh look, this is where we're getting",DIR,BNCFXM,,,30470.0,93815.0,1.0,0.0,0.0,,-1
oh yeah you bet you bet and with computer technology now look how spooky it is for how accessible these things are,DIR,sw2697A-ms98-a-0104,515.337,529.98875,,,1.0,0.0,0.0,,-1
"Oh, look. Mm Oh, look. What? Look, that he's into Well I mean he's no problem to me",DIR,BNCKB2,,,2447.0,6100.0,1.0,0.0,0.0,,-1
Patients experienced improved health outcomes thanks to productive dialogue and shared decision-making regarding their care.,DIR,,,,,,,,,,-1
"right I'm pleased [laugh] pleased to introduce to us, er, er against all these difficulties and the nearer you are at the front the better, there's all stuff here look",DIR,BNCF71,,,13.0,77101.0,0.0,1.0,0.0,,-1
"See there's the one trying to come out, look . Look. And he got straight in front there",DIR,BNCFM0,,,777.0,84601.0,1.0,0.0,0.0,,-1
"So if I take this one and put this one  I can superimpose the red  straight away I've superimposed a group, but look  the blue and re , and the white are out.",DIR,BNCF7U,,,1075.0,78701.0,1.0,0.0,0.0,,-1
"sorry they're extinct they are, look!that's like the one we bought in Edinburgh, remember?",DIR,BNCKB3,,,1504.0,6640.0,1.0,0.0,0.0,,-1
"sshh, look, there's Paul look, there's Paul cleaning his car",DIR,BNCKB8,,,4154.0,6900.0,1.0,0.0,0.0,,-1
"stop here, we'll we'll cross here look. I wonder why she likes me?",DIR,BNCKB8,,,1121.0,6900.0,1.0,0.0,0.0,,-1
that sort Look,DIR,BNCJA4,,,1226.0,117801.0,1.0,0.0,0.0,,-1
the kids said gosh look how many of these bus drivers are women and i said you know that really is a good indication of some of the jobs that have been,DIR,sw2329B-ms98-a-0059,195.3085,196.59875,,,1.0,0.0,0.0,,-1
"the teacher acts as a conscience  I I explained to them I'm not expecting them to make the child do the work, but to be their conscience so they can say look you've got three assessments coming in that week  if you leave it till Friday night you're up the creak without a paddle!",DIR,BNCHYV,,,157.0,109201.0,1.0,0.0,0.0,,-1
there is the backview look. I mean that's that's a backdoor,DIR,BNCKB7,,,7630.0,1820.0,1.0,0.0,0.0,,-1
They're lovely. Like them. Oxfam. Not Oxfam. Look. Its even got. Aren't they nice,DIR,BNCKB7,,,9724.0,1820.0,1.0,0.0,0.0,,-1
"They're the ones who are saying, Look.",DIR,BNCFUJ,,,2078.0,87905.0,1.0,0.0,0.0,,-1
"What a strange place it was. LOOK here, look here Scott",DIR,BNCKB3,,,1273.0,6640.0,1.0,0.0,0.0,,-1
"What's happened Lisa Look, if I press those two fingers, can you see they go white?",DIR,BNCFLY,,,23.0,84502.0,1.0,0.0,0.0,,-1
yeah and then and then some some rich yo-yo walks in there who's buddies with the bank president saying look i want to borrow,DIR,sw2688B-ms98-a-0021,112.4,122.64,,,1.0,0.0,0.0,,-1
yeah look. For that fifty pence. It's in the corner look,DIR,BNCKB7,,,9343.0,1820.0,1.0,0.0,0.0,,-1
yeah that's uh you know it it it it could blow things right away for them you know unless they say well look i mean unless they walk it won't,DIR,sw4344A-ms98-a-0064,230.3935,236.877,,,1.0,0.0,0.0,,-1
You can have theYeah.That corporate standards would apply there.Look.Whether we like it or not,DIR,BNCFUJ,,,1750.0,87904.0,1.0,0.0,0.0,,-1
"You've got one or two there, look, that come along.",DIR,BNCD96,,,47.0,8501.0,1.0,0.0,0.0,,-1
"your brother is being naughty, he's run away up the street look! Where is Bryony?",DIR,BNCKB8,,,993.0,6900.0,1.0,0.0,0.0,,-1
