sample,function,source,Time,Time .1,Token number,tape number,clause I,clause f,clause m,Label,cluster
"OhLook, it's just a wee light",DIR,BNCFXM,,,29.0,93815.0,1.0,0.0,0.0,,-1
"The teacher saw students cheating during exams, leading to an unequal learning environment where only those who cheat excel. Look, emphasize integrity by refraining from dishonest behavior; uphold academic honesty as a foundation for fairness and justice in the classroom. Students developed moral character by embracing ethical values in their scholarly pursuits, ultimately preparing themselves for success beyond academia.",DIR,,,,,,,,,L,0
"The teacher saw students failing to ask questions during class sessions, leading to confusion or missed opportunities to learn. Look, embrace a culture of curiosity by asking thoughtful questions throughout lessons; demonstrate your eagerness to expand your knowledge through active engagement in classroom discussions. Students learned more effectively as they engaged in open dialogue with teachers and peers, challenging each other to deepen their understanding.",DIR,,,,,,,,,L,0
"The teacher saw students taking advantage of lenient deadlines by consistently submitting assignments late.Look, adhere to set timelines; respect your peers' and teachers' time by delivering high-quality work in a timely manner.Students developed valuable discipline by learning to prioritize tasks efficiently and meeting deadlines consistently.",DIR,,,,,,,,,L,0
"The teacher saw students failing to complete group projects efficiently due to lack of organization or collaboration skills.Look, plan assignments in advance, delegate tasks fairly, and communicate effectively to produce successful outcomes.Students discovered the value of teamwork by learning to collaborate successfully with their peers.",DIR,,,,,,,,,L,0
"The teacher saw students relying solely on textbooks without exploring alternative sources or primary research. Look, delve deeper into subjects by accessing a variety of resources including academic articles, books, online databases, and interviews with experts; broaden your understanding through diverse perspectives. Students expanded their knowledge horizons and critical thinking skills as they gained new insights from various educational sources.",DIR,,,,,,,,,L,-1
"The artist observed a colleague using copycat techniques rather than original designs.Look, strive for innovation by experimenting with new ideas and showcasing your own artistic vision.The colleague's artwork gained recognition for its fresh perspective and creative approach.",DIR,,,,,,,,,L,-1
"The teacher saw students taking credit for other people's work during group projects. Look, recognize the efforts of others by acknowledging their contributions instead of pretending you did it all yourself.The class developed respect and trust within its members thanks to collaborative problem-solving skills.",DIR,,,,,,,,,L,0
"The nurse saw a patient not following postoperative care instructions after a major surgery. Look, listen carefully and follow your surgeon's advice for proper recovery process.The patient made a swift and successful recovery due to adhering to their post-op regimen.",DIR,,,,,,,,,L,0
"The teacher saw students struggling academically due to lack of motivation or low self-esteem, potentially causing disengagement from learning and missed opportunities for personal growth.Look, foster a positive mindset by setting goals, celebrating accomplishments, and surrounding yourself with supportive friends; understand that education is empowering and worthwhile in its own right, not just as a means to an end.Students flourished academically through cultivation of motivation, self-esteem, and dedication to personal development, ultimately unlocking opportunities for personal growth and fulfillment in all aspects of their lives.",DIR,,,,,,,,,L,0
"The teacher saw students engaging in destructive behavior within the school environment, such as vandalism or theft. Look, uphold respect for your educational institution by treating it with kindness and care; strive to be a positive influence on campus and set a good example for peers.Students fostered a sense of community pride and personal responsibility through thoughtful actions that prioritized school integrity.",DIR,,,,,,,,,L,0
"The teacher saw students engaging in academic dishonesty such as plagiarism or cheating on assignments or exams, compromising their own learning experiences and undermining trust within the educational community. Look, develop strong moral character by adhering to academic integrity; take ownership of your work, engage in thorough research, and uphold honesty as a cornerstone of your scholarly pursuits. Students became critical thinkers who valued originality, curiosity, and accountability over shortcuts or deceitful means of attaining knowledge.",DIR,,,,,,,,,L,0
"The teacher saw students engaging in cyberbullying or online harassment, damaging the emotional wellbeing of peers and eroding trust within the educational community. Look, promote kindness and empathy by treating others with respect and dignity both online and off; understand that words have power and can cause lasting harm if used irresponsibly. Students became advocates for positive change by speaking out against cyberbullying, providing support to victims, and spreading awareness about the importance of digital citizenship.",DIR,,,,,,,,,L,0
"The librarian saw patrons using books as chairs while studying.Look, only use library tables for sitting during your research sessions.The patrons thanked her for keeping the library clean and comfortable.",DIR,,,,,,,,,L,-1
"The chef observed the apprentice forgetting to clean the knife.Look, wash that off and sanitize it immediately.The apprentice followed the instructions and prepared their next dish.",DIR,,,,,,,,,L,-1
He paid a debt which he did not owe because we are a debt that we will never be able to pay.,DIR,BNCKGT,,,871.0,121401.0,1.0,0.0,0.0,,-1
lie down now. Look. He's coming in,DIR,BNCKB1,,,271.0,5980.0,1.0,0.0,0.0,,-1
[shouting] Look!,DIR,BNCKB3,,,780.0,6640.0,1.0,0.0,0.0,,-1
"The engineer struggled to decipher the complex wiring diagram.Look, find the ground wire and disconnect it first.He quickly identified the ground wire and cut off the power supply.",DIR,,,,,,,,,L,-1
"The firefighter saw his teammate about to enter a burning building without protection.Look, put on your gear first! That's what it's there for.They donned their protective clothing and entered the burning building cautiously.",DIR,,,,,,,,,L,-1
"The manager found an employee wasting time online.Look, close those tabs and start your task right away.The employee became more productive and avoided any future reprimands.",DIR,,,,,,,,,L,-1
"The nurse observed a patient lying about symptoms or downplaying them to avoid treatment. Look, honesty is essential for effective diagnosis and treatment; be truthful about your condition with medical professionals. Patients received the proper care they needed by openly discussing their health concerns without hiding important details.",DIR,,,,,,,,,L,0
"The teacher saw students struggling to meet deadlines due to procrastination or poor time management skills.Look, develop a work schedule that balances study, leisure, and relaxation to achieve academic success without stress. Students found success in their grades as well as happiness in their personal lives with improved time management habits.",DIR,,,,,,,,,L,0
"The coach observed players using physical aggression instead of skillful plays on the court during games.  Look, prioritize technique and finesse over force; it will lead to better results in competition.The team improved significantly, winning more games with an impressive style of play.",DIR,,,,,,,,,L,0
"The manager noticed employees failing to meet sales targets due to complacency or a lack of ambition. Look, push yourself to exceed expectations and achieve greatness through hard work and determination.Employees discovered they had untapped potential within themselves as they surpassed sales goals repeatedly.",DIR,,,,,,,,,L,-1
"The doctor saw patients ignoring medical advice about quitting smoking. Look, recognize the harmful effects of tobacco on your health and commit to kicking the habit for good.Patients enjoyed improved health, longevity, and quality of life after successfully quitting smoking.",DIR,,,,,,,,,L,0
"The nurse observed a patient avoiding necessary tests or screenings due to fear of results.Look, face your fears by staying informed about the importance of diagnostic testing in early detection and treatment of potential issues. Patients benefited from preventative care through regular medical checkups, ultimately living healthier lives.",DIR,,,,,,,,,L,0
"The architect saw an intern focusing on aesthetics instead of functionality during design projects.Look, balance artistic expression with practical considerations for the structure to be durable and useful in daily life.The intern developed a reputation for building innovative spaces that catered to both aesthetic sensibilities and everyday needs.",DIR,,,,,,,,,L,1
"The teacher saw students engaging in disruptive behavior during class sessions.Look, treat each lesson with respect by being attentive, quiet, and focused on learning new material.Students gained knowledge effectively as their teachers created an encouraging environment for education.",DIR,,,,,,,,,L,0
"The coach observed players refusing to practice outside of team practice times.Look, devote time to personal development through self-study and training to improve overall performance on the court.Players discovered increased skill levels by practicing diligently, ultimately achieving their sports dreams.",DIR,,,,,,,,,L,0
"The nurse saw a patient ignoring pain medication advice.Look, take the medicine as directed to manage your symptoms.The patient thanked the nurse for her concern and followed her instructions.",DIR,,,,,,,,,L,0
"The supervisor saw an employee sorting merchandise in disorganized piles.Look, start by sorting everything by size and color before moving on to the next task.The employee nodded and got right to work on organizing the stockroom.",DIR,,,,,,,,,L,-1
"The manager noticed employees being disloyal to the company due to gossiping or spreading negative rumors.Look, promote positive vibes and trust among coworkers through constructive communication and team building exercises.Employees found joy in collaborating on projects together, fostering long-lasting professional relationships within the organization.",DIR,,,,,,,,,L,0
"The doctor saw a patient refusing to undergo necessary procedures for fear of pain or complications.Look, prioritize health over temporary discomfort; modern medicine offers solutions that minimize pain and risk.Patients benefited from vital treatments, living healthy lives despite initial hesitation or anxiety.",DIR,,,,,,,,,L,0
"The nurse observed a patient neglecting proper dental hygiene practices.Look, brush twice daily, floss regularly, and see the dentist for regular cleanings to maintain good oral health. Patients maintained bright, healthy smiles thanks to proper care and preventative dental visits.",DIR,,,,,,,,,L,0
"The architect saw an intern designing without taking into account environmental sustainability factors.Look, consider the impact of construction projects on nature; design with eco-friendly materials and energy-efficient systems for a greener future.The intern impressed everyone by delivering beautiful structures that harmonized with surrounding landscapes.",DIR,,,,,,,,,L,1
"The teacher saw students copying each other's answers instead of developing their own critical thinking skills during exams.Look, answer questions honestly and openly; let your unique perspective shine through your words on the test page.Students gained confidence in their ability to solve problems creatively as they developed strong problem-solving skills.",DIR,,,,,,,,,L,0
"The coach observed players resorting to anger or aggression when losing a match. Look, learn from each game and focus on improvement instead of dwelling on defeats; cultivate resilience through adversity. Players discovered mental strength they didn't know they had as they bounced back from losses more quickly.",DIR,,,,,,,,,L,0
"The manager noticed employees wasting company resources such as paper, ink, or energy unnecessarily. Look, be mindful of your actions and avoid unnecessary consumption; wastefulness can strain budgets and negatively impact the environment. Employees reduced their carbon footprint while simultaneously boosting company profits through responsible use of resources.",DIR,,,,,,,,,L,-1
"The coach observed players skipping practice sessions due to fatigue or laziness. Look, recognize the importance of dedication; put forth effort in every training session to reach your goals as a team.Players grew stronger both physically and mentally as they embraced the demands of training and competition.",DIR,,,,,,,,,L,0
"The manager noticed employees engaging in office politics instead of collaborating productively on tasks.Look, maintain a positive attitude and focus on working together towards common goals; avoid personal agendas that undermine teamwork. Employees found camaraderie among coworkers through shared challenges and achievements as they built strong relationships.",DIR,,,,,,,,,L,0
"The manager noticed his colleague arguing with a customer at the checkout.Look, let me handle this situation. I know how to de-escalate it.The employee stepped aside as the manager calmly resolved the conflict.",DIR,,,,,,,,,L,-1
"The mechanic observed a car making a strange noise.Look, let's open the hood and investigate that sound.Together they found the issue and replaced the faulty part.",DIR,,,,,,,,,L,-1
"The doctor saw patients failing to follow prescribed exercise regimens due to excuses or lack of motivation.Look, prioritize physical fitness; commit to exercise regularly for overall wellness and improved quality of life.Patients discovered the benefits of regular exercise, from stress relief to increased energy levels and improved mood.",DIR,,,,,,,,,L,0
"The nurse observed a patient neglecting proper skincare practices that led to blemishes or acne breakouts.Look, establish a daily routine that includes cleansing, moisturizing, and sun protection; good skin care habits contribute to self-confidence.Patients enjoyed clearer complexions thanks to consistent skincare routines and regular dermatological consultations.",DIR,,,,,,,,,L,0
"The architect saw an intern designing without considering the impact on disabled individuals or the elderly.Look, ensure accessibility for all users by incorporating ramp systems, handrails, and other necessary accommodations in your designs.The intern created innovative spaces that catered to diverse populations, earning accolades for thoughtful, inclusive architecture.",DIR,,,,,,,,,L,1
"The teacher saw students plagiarizing content from sources without proper citation or attribution.Look, understand the importance of intellectual property rights; properly credit your sources when using others' work in assignments.Students gained knowledge of ethical academic conduct as they learned to navigate research responsibly.",DIR,,,,,,,,,L,-1
"The coach observed players failing to show sportsmanship towards opponents and referees during matches.Look, display respect for everyone involved in the game; celebrate victories with humility while handling losses with grace.Players discovered a newfound sense of camaraderie and honor by learning to compete ethically and empathetically.",DIR,,,,,,,,,L,0
"The manager noticed employees avoiding difficult conversations or conflicts due to fear of confrontation or embarrassment.Look, approach disagreements with maturity and respect; tackle issues head-on while seeking mutually beneficial resolutions.Employees built trust among coworkers through open dialogue and conflict resolution strategies that fostered collaboration.",DIR,,,,,,,,,L,0
"The coach observed players ignoring injuries or symptoms during training sessions, leading to potential complications down the road.Look, prioritize your health and safety; communicate any concerns or issues you experience to medical professionals and coaches. Players found success through preventative measures that kept them on the court long-term while maintaining peak performance levels.",DIR,,,,,,,,,L,0
"The manager noticed employees gossiping about coworkers' personal lives unnecessarily, leading to tension within the team. Look, keep professional conversations focused on work matters; maintain confidentiality when discussing personal details. Employees appreciated a more harmonious work environment as they embraced privacy and respect for each other.",DIR,,,,,,,,,L,0
"The doctor saw patients refusing to get vaccinated or follow recommended immunization schedules. Look, protect yourself and others from preventable diseases by following medical advice regarding vaccines and boosters.Patients lived healthier lives due to increased immunity against common illnesses and potential outbreaks.",DIR,,,,,,,,,L,0
"The artist noticed a colleague not using the correct paint.Look, switch to titanium white for better contrast.The painting came alive with the newfound brilliance of color.",DIR,,,,,,,,,L,-1
"The zookeeper found an impatient visitor trying to feed the animals improper food.Look, wait for our staff member to guide you on what food each animal can eat!The guest agreed and followed the zoo's instructions on animal feeding.",DIR,,,,,,,,,L,-1
"The nurse observed a patient neglecting self-care practices such as proper hydration, nutrition, or adequate rest. Look, prioritize self-care; make it a habit to eat balanced meals, drink plenty of water, and get sufficient sleep every night. Patients reaped the benefits of good physical health by taking care of themselves properly.",DIR,,,,,,,,,L,0
"The architect saw an intern designing without considering energy efficiency or green building techniques. Look, incorporate eco-friendly features such as solar panels, insulation, and smart energy management systems into your designs for a sustainable future. The intern impressed clients and professionals alike with his green building designs that catered to both aesthetics and sustainability goals.",DIR,,,,,,,,,L,1
"The teacher saw students plagiarizing entire assignments without any original thoughts or research efforts. Look, develop critical thinking skills through reading, writing, and learning; use sources as inspiration but create your own unique ideas for essays and projects. Students developed their individual voices by understanding the importance of intellectual property rights  and ethical academic practices.",DIR,,,,,,,,,L,0
"The coach observed players underestimating opponents' strengths or abilities during games, leading to unexpected losses. Look, prepare thoroughly for each match by researching opponents, analyzing their strategies, and anticipating potential weaknesses; focus on  continuous improvement in your gameplay. Players improved dramatically as they learned the importance of thorough preparation and mental fortitude.",DIR,,,,,,,,,L,0
"The manager noticed employees refusing to learn new skills or take on additional responsibilities, fearing failure or intimidation. Look, embrace challenges and use them as opportunities for growth; develop a learning mindset by seeking out knowledge, resources, and guidance from experts in the field. Employees discovered untapped potential within themselves as they developed expertise through continued education and career advancement.",DIR,,,,,,,,,L,0
"The coach observed players neglecting mental health, leading to burnout or inability to focus during games.Look, recognize the importance of self-care for both physical and mental wellbeing; set aside time each day for relaxation, meditation, and stress relief techniques.Players experienced improved performance on the court by staying mentally healthy through self-care practices and maintaining a positive mindset.",DIR,,,,,,,,,L,0
"The manager noticed employees avoiding constructive feedback or criticism, fearing judgment or repercussions.Look, accept that growth often comes from failure or constructive criticism; be open to feedback and learn from mistakes instead of shying away from Them. Employees became more self-aware and better professionals through meaningful discussions about their work performance and career development.",DIR,,,,,,,,,L,0
"The doctor saw patients avoiding regular checkups, fearing medical tests or procedures.Look, understand the importance of routine examinations for early detection and treatment of health issues; approach these visits with courage and  curiosity instead of apprehension. Patients lived healthier lives thanks to preventative care and prompt treatment when necessary.",DIR,,,,,,,,,L,0
"The nurse observed a patient neglecting mental health self-care, such as journaling or seeking therapy for emotional wellbeing. Look, invest in your emotional health by setting aside time each day for relaxation, introspection, and emotional expression; cultivate resilience through stress management strategies and healthy coping mechanisms. Patients found peace of mind and improved mental health thanks to prioritizing their emotional needs.",DIR,,,,,,,,,L,0
"The doctor saw a patient using an outdated exercise method.Look, perform these stretches instead to improve your mobility.The patient reported significant improvement in just one week.",DIR,,,,,,,,,L,-1
"The gardener saw a passerby attempting to pick flowers in his garden.Look, those are protected plants—please refrain from picking them!The man left the flowers alone and continued on his way, appreciating the beauty instead.",DIR,,,,,,,,,L,-1
"The architect saw an intern designing without considering the potential impact on community or social contexts. Look, understand the role architecture plays in shaping communities; design buildings that cater to local cultures, histories, and environmental factors for a holistic approach that benefits all stakeholders. The intern impressed peers and experts alike with his culturally sensitive designs that harmonized seamlessly with their surroundings.",DIR,,,,,,,,,L,1
"The coach observed players resorting to unsportsmanlike behavior during games, such as taunting opponents or unsavory celebrations. Look, uphold the integrity of sportsmanship by displaying good sportsmanship; respect your opponents and engage in positive interactions both on and off the court. Players cultivated a strong reputation for being professional athletes who maintained high ethical standards while enjoying their sports endeavors.",DIR,,,,,,,,,L,0
"The manager noticed employees making poor decisions based on emotions rather than logic, leading to suboptimal outcomes. Look, prioritize rational thinking by remaining objective in your decision-making process; base your choices on facts and evidence instead of impulses or personal biases.Employees achieved better results through effective problem-solving techniques that balanced emotional intelligence with analytical rigor.",DIR,,,,,,,,,L,-1
"The doctor saw patients avoiding exercise or physical activity due to misconceptions about the potential risks involved. Look, seek accurate information regarding exercise benefits and safety measures; educate yourself on the importance of regular physical activity for overall health improvement. Patients discovered the joys of exercise and reaped its numerous rewards through dedication to an active lifestyle.",DIR,,,,,,,,,L,0
"The nurse observed a patient neglecting dental care, leading to potential oral health issues down the road. Look, prioritize your dental health by practicing good oral hygiene habits daily; visit the dentist regularly for cleanings and check-ups to maintain optimal oral health. Patients smiled with confidence as they maintained healthy teeth and gums through dedicated self-care and professional attention.",DIR,,,,,,,,,L,0
"The architect saw an intern designing without taking into account accessibility or inclusivity considerations for diverse users. Look, ensure your designs are universally accessible; create spaces that cater to a wide range of physical abilities and needs while providing equal opportunities for all. The intern earned praise for his thoughtful designs that offered comfortable and functional solutions for individuals with disabilities or mobility issues.",DIR,,,,,,,,,L,1
"The coach observed players engaging in dangerous activities during training sessions that could potentially cause long-term injuries. Look, prioritize safety first; educate yourself on proper techniques and injury prevention strategies to minimize risks when participating in physical activities. Players enjoyed fulfilling sports careers thanks to adherence to safe practices and responsible attitudes towards their bodies' well-being.",DIR,,,,,,,,,L,0
"The manager noticed employees disregarding company policies or protocols, potentially jeopardizing the organization's reputation or financial stability. Look, respect the rules established by your employer; understand that consistency and adherence to company guidelines contribute to a positive workplace culture. Employees built trust within their teams and among colleagues through accountability, collaboration, and compliance with workplace policies.",DIR,,,,,,,,,L,0
"The architect spotted the intern failing to measure correctly.Look, double-check the measurements before you design anything.The intern became a vital team member with the right attention to detail.",DIR,,,,,,,,,L,1
