sample,function,source,Time,Time .1,Token number,tape number,clause I,clause f,clause m,Label,cluster
"The coach found one of his players fidgeting on the bench during a crucial game.Look, focus on your breathing and visualize a successful play in your mind.The player did as instructed and returned to the field, full of confidence.",DIR,,,,,,,,,L,-1
"The doctor saw patients refusing recommended lifestyle changes or medication adjustments due to perceived inconvenience or discomfort. Look, prioritize long-term health benefits over short-term comfort; work closely with healthcare providers to create manageable action plans tailored to your unique needs. Patients lived longer, healthier lives thanks to effective management of their health issues through commitment and perseverance in pursuit of wellness.",DIR,,,,,,,,,L,0
"The coach observed players showing disregard for the opposing team's dignity or safety during games, leading to increased animosity and unsportsmanlike conduct. Look, practice good sportsmanship by treating opponents with respect; honor the spirit of competition while remaining mindful of fairness and player safety at all times. Players cultivated a strong reputation for being professional athletes who prioritized sportsmanship and camaraderie over animosity or aggression.",DIR,,,,,,,,,L,0
"The manager noticed employees neglecting teamwork or collaboration, opting instead for individualistic approaches that compromised overall project success. Look, value teamwork as an essential component of any successful endeavor; embrace collaboration by contributing your unique strengths while respecting the talents and ideas of others. Employees thrived in their careers through collective problem-solving techniques and mutual support in reaching common goals.",DIR,,,,,,,,,L,0
"The doctor saw patients failing to take necessary precautions against contagious diseases, putting themselves and others at risk of infection. Look, prioritize your health and the health of those around you by following guidelines for disease prevention; understand that simple measures such as handwashing and vaccinations can significantly reduce the spread of infectious illnesses.Patients enjoyed better health outcomes thanks to a commitment to personal responsibility in maintaining cleanliness and adhering to preventative healthcare measures.",DIR,,,,,,,,,L,0
"The nurse observed a patient disregarding self-care practices, such as failing to manage stress or engage in adequate exercise, leading to increased vulnerability to various medical issues.Look, prioritize self-care by setting aside time each day for relaxation, physical activity, and mental health maintenance; recognize that taking care of yourself is essential for long-term wellness and happiness. Patients improved their quality of life by practicing self-compassion and investing in their overall well-being.",DIR,,,,,,,,,L,0
"The architect saw an intern designing without considering the environmental impact of construction materials or techniques used, potentially contributing to pollution and resource depletion.Look, advocate for sustainability by using eco-friendly materials and employing energy-efficient designs; be conscious of your impact on the environment and work towards a greener future in your architectural pursuits.The intern impressed clients and professionals alike with his sustainable designs that balanced aesthetics with environmental responsibility.",DIR,,,,,,,,,L,1
"The teacher saw students struggling academically due to lack of study skills, organization, or time management abilities. Look, equip yourself with essential learning strategies by developing a study routine, setting priorities, and establishing realistic goals; seek help from teachers, tutors, or mentors if necessary. Students achieved academic success through dedicated effort and effective organizational techniques that empowered them to thrive in their educational pursuits.",DIR,,,,,,,,,L,0
"The coach observed players ignoring feedback or criticism from coaches or teammates, limiting their opportunities for growth and improvement. Look, welcome constructive criticism as an opportunity for self-improvement; embrace a growth mindset by valuing honest feedback and using it to inform your development as an athlete. Players transformed into formidable competitors through a commitment to continuous learning and refinement of their skills based on thoughtful advice from coaches, teammates, and peers.",DIR,,,,,,,,,L,0
"The manager noticed employees resisting change or innovation, stifling progress and limiting the organization's potential for growth. Look, foster adaptability by embracing new ideas and welcoming innovative solutions; recognize that change is necessary for continued success and be open to learning from others in the industry.Employees thrived in their careers by adapting quickly to shifting trends and evolving technologies, driving the organization forward towards increased prosperity and longevity.",DIR,,,,,,,,,L,0
"The art teacher observed some students attempting to mix colors recklessly.Look, try mixing complementary colors first before adding secondary ones for more vibrant results.The students diligently followed their teacher's advice, resulting in a beautiful palette.",DIR,,,,,,,,,L,-1
"The chef found a cook not following recipe instructions.Look, adhere strictly to this recipe for the best results.The cook's dishes earned rave reviews and won them new customers.",DIR,,,,,,,,,L,-1
"The coach observed players prioritizing personal glory over team success, leading to discordant locker room dynamics and reduced overall performance. Look, prioritize unity and camaraderie among teammates by placing the collective good above individual ambition; celebrate each other's achievements  while recognizing that a strong team depends on mutual support and trust. Players cultivated winning teams that thrived under an ethos of cooperation and brotherhood, ultimately earning success through shared sacrifice and commitment.",DIR,,,,,,,,,L,0
"The manager noticed employees neglecting their professional development, leading to stagnation in their careers or reduced potential for growth within the organization. Look, invest in yourself by continually learning, expanding your skill set, and seeking out opportunities for advancement; prioritize personal and professional development as key components of long-term success.Employees became valuable contributors to the company through ongoing education, increased proficiency, and dedication to career progression.",DIR,,,,,,,,,L,0
"The doctor saw patients refusing recommended treatments or medications due to fear, misconceptions, or mistrust in medical professionals.growth and fulfillment.openness and curiosity instead of apprehension or skepticism. openness and curiosity instead of apprehension or skepticism.",DIR,,,,,,,,,L,-1
"The nurse observed a patient neglecting mental health self-care, such as avoiding social interactions or refusing counseling services. Look, recognize the importance of mental health maintenance by seeking help when needed; prioritize your emotional wellbeing by fostering positive relationships, engaging in meaningful activities, and practicing stress reduction techniques.Patients enjoyed happier, healthier lives thanks to proactive attention towards mental health needs and a commitment to holistic self-care.",DIR,,,,,,,,,L,0
"The architect saw an intern designing without taking into account the socioeconomic impacts of their work, potentially contributing to issues like gentrification or housing disparities.Look, strive for social responsibility in your architectural pursuits by incorporating elements of accessibility, affordability, and community involvement; engage with stakeholders to ensure that your designs serve the broader public interest.The intern earned respect from clients, professionals, and advocates alike by creating buildings that addressed pressing societal needs and provided lasting benefits to diverse communities.",DIR,,,,,,,,,L,1
"The teacher saw students struggling academically due to lack of focus or motivation, leading to disengagement and missed opportunities for personal growth. Look, cultivate a love for learning by setting goals, creating a study routine, and surrounding yourself with positive influences; recognize that education is empowering and worthwhile in its own right, not just as a means to an end. Students flourished in their educational journeys through dedication, perseverance, and appreciation of the transformative power of knowledge.",DIR,,,,,,,,,L,0
"The coach observed players giving up easily when faced with adversity or failure, allowing discouragement to overshadow determination and hard Work. Look, embrace resilience by pushing past obstacles and learning from setbacks; recognize that failure is an essential aspect of growth and perseverance, not a sign of weakness or defeat. Players developed winning mindsets by adapting quickly to challenges, adopting strategies for improvement, and displaying grit in the face of adversity.",DIR,,,,,,,,,L,0
"The manager noticed employees shirking responsibility, passing the blame onto others for mistakes or errors. Look, take ownership of your work and accept accountability for your actions; practice humility by acknowledging when you are wrong and learning from your mistakes rather than pointing fingers at others. Employees became respected colleagues and valued team members through integrity, transparency, and unwavering commitment to excellence in their respective roles.",DIR,,,,,,,,,L,0
"The doctor saw patients ignoring recommendations regarding diet or nutrition, leading to a host of health problems such as obesity, diabetes, or heart disease. Look, prioritize health by making conscious decisions about what you consume; seek out nutrient-rich foods and practice moderation in all things, recognizing that maintaining a balanced diet is essential for overall wellness.Patients enjoyed better health outcomes through thoughtful dietary choices and dedication to optimal nutrition as foundational components of holistic wellbeing.",DIR,,,,,,,,,L,0
"The bartender noticed a patron overindulging on drinks at the bar.Look, let me serve you water now so that you can stay hydrated.The guest agreed and appreciated the bartender's care as they enjoyed their evening.",DIR,,,,,,,,,L,-1
"The teacher observed students texting during the lecture.Look, put your phones away until the break so we can concentrate.The students thanked the teacher for a productive learning experience.",DIR,,,,,,,,,L,0
"The nurse observed a patient neglecting personal hygiene, potentially leading to various medical issues or exacerbating existing conditions. Look, recognize the importance of cleanliness in maintaining good health; practice regular handwashing, oral care, and bathing while staying current on vaccinations to reduce your vulnerability to illnesses.Patients experienced improved physical well-being thanks to conscientious self-care routines and vigilance regarding hygienic practices.",DIR,,,,,,,,,L,0
"The coach observed players showing disregard for coaches or staff, failing to follow instructions or exhibiting insubordination during practices or games. Look, demonstrate respect and obedience towards authority figures by understanding that rules are in place for a reason; practice humility by following instructions willingly, recognizing that discipline and guidance from experienced mentors are essential components of success as an athlete. Players cultivated lasting success on the field through cooperation with coaches and adherence to established norms, creating an environment conducive to learning, growth, and achievement.",DIR,,,,,,,,,L,0
"The manager noticed employees disregarding company values or guidelines, compromising organizational culture and undermining trust among colleagues. Look, embody the values of your organization by upholding high ethical standards in all aspects of work; adhere strictly to policies and procedures  while advocating for transparency and accountability at every level. Employees fostered a strong sense of belonging within their workplace by aligning their actions with company principles, reinforcing positive cultural norms, and contributing to a culture of integrity and professionalism.",DIR,,,,,,,,,L,0
"The doctor saw patients disregarding advice regarding exercise or physical activity, potentially leading to a sedentary lifestyle and increased risk of chronic health issues like obesity or diabetes. Look, prioritize fitness by setting realistic goals for physical activity and seeking out opportunities to stay active; recognize that incorporating exercise into daily life is essential for maintaining good health and promoting longevity. Patients experienced improved quality of life through dedicated effort towards wellness and the development of lifelong habits that support optimal health outcomes.",DIR,,,,,,,,,L,0
"The nurse observed a patient neglecting self-care or refusing treatment, potentially exacerbating existing medical conditions or delaying recovery from illnesses. Look, prioritize your health by adhering to prescribed treatment plans and following recommendations for self-care; recognize that attending regular check-ups, taking medication as directed, and engaging in preventative care are key components of maintaining good health. Patients enjoyed better health outcomes through conscientious adherence to medical guidance and diligence in monitoring their overall wellbeing.",DIR,,,,,,,,,L,0
"The architect saw an intern designing without considering the impact of their work on local ecosystems or wildlife habitats, potentially contributing to habitat loss, pollution, or species extinction.Look, strive for sustainability by incorporating elements of environmental conservation and wildlife preservation into your designs; engage with ecologists, biologists, and other experts to ensure that your projects align with best practices for responsible development. The intern earned acclaim from clients, professionals, and advocates alike by creating buildings that prioritized harmony between human needs and natural habitats, promoting a more balanced and sustainable future for both species and structures.",DIR,,,,,,,,,L,1
"The teacher saw students neglecting their assignments or failing to attend class regularly, compromising their own educational opportunities and potentially damaging their future prospects.Look, recognize the value of education as an investment in your future; prioritize academic success by maintaining a regular study routine, seeking help when needed, and attending classes diligently.Students secured brighter futures through dedicated effort, perseverance, and commitment to lifelong learning, unlocking opportunities for personal growth and fulfillment.",DIR,,,,,,,,,L,0
"The coach observed players engaging in hazing or other harmful behaviors towards teammates, creating a toxic culture of bullying and fostering emotional harm within the locker room.Look, promote a positive and supportive environment by treating all members of your team with respect and kindness; recognize that each individual has unique strengths, challenges, and experiences, and should be treated with empathy and compassion. Players cultivated strong teams by emphasizing mutual support, empathy, and accountability among peers, creating an atmosphere conducive to growth, personal development, and success on the field.",DIR,,,,,,,,,L,0
"The manager noticed employees exhibiting unprofessional behavior such as gossiping, spreading rumors, or otherwise damaging the professional reputation of colleagues or the company as a whole. Look, maintain a positive and respectful work environment by treating all interactions with integrity and courtesy; focus on building relationships based on trust, communication, and collaboration rather than engaging in destructive office politics. Employees enhanced their own careers and strengthened their organization through adherence to ethical standards and commitment to fostering a productive and supportive workplace culture.",DIR,,,,,,,,,L,0
"The coach saw the athletes warming up carelessly.Look, stretch thoroughly and focus on your breathing.The team scored the winning goal with their improved agility.",DIR,,,,,,,,,L,-1
"The doctor observed her patient getting agitated before a painful procedure.Look, take deep breaths and concentrate on something calming to help you relax.The patient listened, felt better, and was able to complete the necessary treatment.",DIR,,,,,,,,,L,0
"The doctor saw patients failing to prioritize sleep, potentially compromising immune function, cognitive ability, or emotional wellbeing. Look, recognize the importance of rest for overall health and productivity; establish a consistent sleep schedule, create a calming nighttime routine, and ensure that your sleeping environment is conducive to optimal rest. Patients experienced improved quality of life through dedicated attention towards maintaining healthy sleep habits and fostering an environment that supports deep, restorative slumber.",DIR,,,,,,,,,L,0
"The manager found the employee chatting with coworkers during work hours.Look, attend to your duties promptly so we can finish earlier.The employee's productivity increased, earning them a promotion.",DIR,,,,,,,,,L,-1
"The museum guard saw some visitors taking photographs in restricted areas.Look, please refrain from taking photos of any exhibits with red signs.The visitors respectfully complied, and the museum maintained its pristine condition.",DIR,,,,,,,,,L,-1
"The coach observed players giving up on challenging plays or difficult situations, surrendering their athletic potential to fear or timidity.Look, embrace a winning mentality by pushing past your limits, facing challenges head-on, and refusing to accept defeat; understand that adversity is an opportunity for growth and that overcoming obstacles strengthens both mind and body. Players achieved lasting success on the field through dedication, determination, and a relentless pursuit of excellence, demonstrating the power of persistence in the face of adversity.",DIR,,,,,,,,,L,0
"The flight attendant observed a passenger using a mobile phone mid-flight.Look, turn off your device now until landing.The passenger obliged and placed their phone in the airplane mode.",DIR,,,,,,,,,L,-1
"The librarian watched as students passed books between each other without wearing gloves.Look, remember to wear disposable gloves when handling library books!The students understood the importance of protecting books from germs and bacteria.",DIR,,,,,,,,,L,-1
"The mechanic observed his apprentice making errors on the car.Look, triple-check all of your work before you move on.The apprentice fixed the car with accuracy and confidence.",DIR,,,,,,,,,L,-1
"The chef saw the sous chef using subpar ingredients.Look, only use the freshest produce to create our signature dishes.The restaurant received positive reviews from satisfied customers.",DIR,,,,,,,,,L,-1
"The construction worker saw his coworker attempting a task that was beyond their capabilities.Look, ask someone with more experience for help before continuing!Together, they successfully completed the project, learning something valuable in the process.",DIR,,,,,,,,,L,-1
"The security guard noticed two strangers whispering suspiciously near an entrance.Look, step away from the entrance and wait for my return so we can properly identify you.The individuals obliged, allowing the guard to conduct a thorough check of their credentials.",DIR,,,,,,,,,L,-1
"The teacher noticed students sleeping during a history lesson.Look, take a deep breath and try to stay alert.The students began focusing on the lesson and their grades improved.",DIR,,,,,,,,,L,-1
"The artist found her colleague not using the right tools for detail work.Look, grab your magnifying glass for finer details in your paintings.The colleague's art earned them a spot in an upcoming gallery show.",DIR,,,,,,,,,L,-1
"The orchestra conductor observed one musician lagging behind the rest during rehearsals.Look, try to play with more enthusiasm—I believe in your talent!Encouraged, the musician improved and caught up with the ensemble's tempo.",DIR,,,,,,,,,L,-1
"The manager observed the employees talking loudly during meetings.Look, keep your discussions respectful and professional at all times.The team received praise from their clients and gained new projects.",DIR,,,,,,,,,L,-1
"The nurse saw a patient refusing to take their medication as prescribed.Look, take your medication as directed for your own well-being and recovery.The patient, having thought it over, agreed to take their medication as instructed by the healthcare team.",DIR,,,,,,,,,L,-1
"The chef noticed his sous-chef making sloppy plating attempts at the serving station.Look, focus on presentation when placing food on each dish!The sous-chef took care to make every plate visually appealing and received praise for their work.",DIR,,,,,,,,,L,-1
"The doctor noticed a patient not taking their medication seriously.Look, never miss doses even when you feel better because it can relapse.The patient thanked the doctor for helping them overcome their illness.",DIR,,,,,,,,,L,-1
"The nurse saw a patient ignoring her advice to get more rest.Look, make sure to get plenty of sleep so you can recover faster.The patient reported feeling much better and followed up with gratitude.",DIR,,,,,,,,,L,-1
"The teacher observed her student texting instead of paying attention during class.Look, turn off your phone and focus on today's lesson so that you can learn something valuable.The student set aside their phone, engaged with the class material, and made significant improvements in their studies.",DIR,,,,,,,,,L,0
"The architect found an intern failing to take accurate measurements.Look, verify your work twice before moving on to the next stage.The intern quickly gained a reputation for her precision and dedication.",DIR,,,,,,,,,L,-1
"The coach noticed a player trying to mimic another player's unique play style.Look, find your own playstyle that highlights your natural skills rather than copying others.Empowered by self-discovery, the player became more confident on the field and began playing with their signature flair.",DIR,,,,,,,,,L,-1
"The lifeguard saw some swimmers engaging in roughhousing in the pool.Look, play safely and consider others around you so that everyone can enjoy their swim!The swimmers apologized and promised to maintain a friendly atmosphere at the pool.",DIR,,,,,,,,,L,-1
"The teacher saw students arguing about their answers during test time.Look, finish writing down your own responses then discuss your differences.The class earned a passing grade with a sense of accomplishment.",DIR,,,,,,,,,L,0
"The coach observed players discussing strategies off the field.Look, focus on your individual improvement first before team strategies.The players came together with newfound unity and determination.",DIR,,,,,,,,,L,0
"The firefighter saw a fellow team member attempting to fight the blaze singlehandedly.Look, call for backup—we work best together to control the flames effectively!The firefighters worked collaboratively and succeeded in containing the fire before it spread further.",DIR,,,,,,,,,L,-1
"The chef found his assistant idle while others were busy preparing dinner.Look, help them with the appetizers so we can keep pace.Together, they soon had enough hors d'oeuvres for all the guests.",DIR,,,,,,,,,L,-1
"The manager noticed employees hesitating to take risks or express original ideas due to fear of failure, stifling creativity and innovation within the organization.Look, cultivate an environment that supports calculated risk-taking and encourages open communication about new ideas; understand that bold action can lead to breakthroughs, advancements, and unparalleled success.Employees fostered professional growth and strengthened their organization through embracing change, innovation, and the willingness to push beyond traditional boundaries in pursuit of progress.",DIR,,,,,,,,,L,0
"The lifeguard noticed a swimmer struggling against strong currents near the deep end.Look, float on your back until I can get to you—I'll guide you safely to shallower waters!The lifeguard managed to assist the swimmer without incident and ensure their safety at all times.",DIR,,,,,,,,,L,-1
"The mechanic noticed the apprentice being careless while repairing a car.Look, take meticulous care and make sure everything is perfect.The apprentice developed a reputation for quality work in the garage.",DIR,,,,,,,,,L,-1
"The artist found her colleague using unorthodox techniques for drawing.Look, learn traditional methods first before experimenting with styles.The artist's pieces gained recognition and were displayed in public shows.",DIR,,,,,,,,,L,-1
"The chef found his intern chopping ingredients carelessly while prepping a delicate dish.Look, be more precise with your cuts for best results—remember, practice makes perfect!Inspired by their mentor's guidance, the intern continued to learn and improve in the kitchen.",DIR,,,,,,,,,L,-1
"The nurse observed an anxious patient refusing to get their blood drawn.Look, I understand your fears but letting me draw your blood is essential for your care—let's work together to make it less scary!The nurse used calming words, distraction techniques, and gentle handholding to reassure the patient, ensuring a successful phlebotomy.",DIR,,,,,,,,,L,0
"The teacher saw students using phones to browse social media during class time.Look, put your devices away during lectures so we can concentrate better.The students thanked the teacher for maintaining a conducive learning environment.",DIR,,,,,,,,,L,0
